{
  "schema_version": "1.0",
  "protocol_version": "1.0",
  "workspace_id": "parallax-chat-bus-hardening-v1",
  "title": "Parallax Chat Bus hardening and architecture review",
  "purpose": "Public-safe recovery record for Parallax's independent Chat Communication Bus review, topology onboarding, design proposal, and verified implementation handoff.",
  "created_at": "2026-09-05T16:37:33.746Z",
  "created_by": {
    "label": "Parallax",
    "route": "Radar Station Work task / Parallax"
  },
  "privacy_class": "PUBLIC_SAFE",
  "checkpoint_policy": {
    "tool_call_interval": 5,
    "exclude_wip_bookkeeping": true,
    "immediate_after_verified_write": true
  },
  "destination": {
    "type": "GITHUB_REPOSITORY",
    "locator": "thebrazenbeard/chat-communication-bus"
  }
}
