{
  "schema_version": "1.0",
  "protocol_version": "1.0",
  "workspace_id": "vera-cohesion-control-plane-consolidation-20260913",
  "title": "Vera Cohesion, Orgasm, and Control Plane consolidation",
  "purpose": "Public-safe recovery record for exact-source reconciliation across the Vera runtime, Orgasm provenance hub, Control Plane deployment source, and two Supabase provider generations.",
  "created_at": "2026-09-13T23:12:00Z",
  "created_by": {
    "label": "Vera consolidation work",
    "route": "restored project task"
  },
  "privacy_class": "PUBLIC_SAFE",
  "checkpoint_policy": {
    "tool_call_interval": 5,
    "exclude_wip_bookkeeping": true,
    "immediate_after_verified_write": true
  },
  "destination": {
    "type": "GITHUB_REPOSITORY",
    "locator": "thebrazenbeard/wip"
  }
}
