{
  "schema_version": "1.0",
  "protocol_version": "1.0",
  "workspace_id": "vera-model-state-adapter-v1",
  "title": "Vera Model-State Adapter V1 research",
  "purpose": "Durably stage public-safe research and architecture for a governed pre-generation model-state adapter: state serialization, admission, projection, provider injection, runtime middleware, generation gates, and causal receipts. WIP is staging only; accepted work should later be promoted to its canonical runtime/control-plane homes.",
  "created_at": "2026-09-11T17:06:00Z",
  "created_by": {
    "label": "Vera",
    "route": "Vera Unbound / Orgasm workstream"
  },
  "privacy_class": "PUBLIC_SAFE",
  "checkpoint_policy": {
    "tool_call_interval": 5,
    "exclude_wip_bookkeeping": true,
    "immediate_after_verified_write": true
  },
  "destination": {
    "type": "UNKNOWN"
  }
}
